{
  "patient_id": "patient_fake_cancer_03",
  "category": "icd_only",
  "lung_cancer_status": "probable",
  "leaf_answers": {
    "pathology_report_present": "no",
    "pathology_lung_primary": "not_applicable",
    "cytology_supports_lung_primary": "no",
    "imaging_lung_lesion": "no",
    "oncologist_lung_cancer_diagnosis_in_note": "no",
    "icd_lung_cancer_present": "yes"
  },
  "applicability": {
    "pathology_lung_primary": "not_applicable",
    "cytology_supports_lung_primary": "applicable"
  },
  "expected_contradicting_evidence_fields": [],
  "difficulty": "easy",
  "difficulty_notes": "API-generated. Seed: orthopedic admission. C34.10 carried into discharge diagnoses list per institutional billing practice (problem-list pull-through); entire hospitalization and follow-up are for right intertrochanteric hip fracture ORIF — no lung cancer evaluation."
}
