{
  "patient_id": "patient_easy_icd_01",
  "category": "icd_only",
  "lung_cancer_status": "probable",
  "leaf_answers": {
    "pathology_report_present": "no",
    "pathology_lung_primary": "not_applicable",
    "cytology_supports_lung_primary": "no",
    "imaging_lung_lesion": "no",
    "oncologist_lung_cancer_diagnosis_in_note": "no",
    "icd_lung_cancer_present": "yes"
  },
  "applicability": {
    "pathology_lung_primary": "not_applicable",
    "cytology_supports_lung_primary": "applicable"
  },
  "expected_contradicting_evidence_fields": [],
  "difficulty": "easy",
  "difficulty_notes": "API-generated. Seed: routine wellness visit. C34.10 persists on problem list as billing carry-forward from prior hospitalization; all chart narrative is for hypertension, diabetes, ankle sprain — no lung cancer evaluation."
}
