{
  "patient_id": "patient_fake_cancer_01",
  "category": "confirmed_nsclc",
  "lung_cancer_status": "confirmed",
  "leaf_answers": {
    "pathology_report_present": "yes",
    "pathology_lung_primary": "nsclc",
    "cytology_supports_lung_primary": "not_applicable",
    "imaging_lung_lesion": "yes",
    "oncologist_lung_cancer_diagnosis_in_note": "yes",
    "icd_lung_cancer_present": "yes"
  },
  "applicability": {
    "cytology_supports_lung_primary": "not_applicable"
  },
  "expected_contradicting_evidence_fields": ["pathology_lung_primary"],
  "difficulty": "hard",
  "difficulty_notes": "Hand-crafted. Tests the manual's re-read rule. Original surgical pathology report calls SCLC based on initial morphology; pathologist re-read addendum (after immunohistochemistry) calls NSCLC adenocarcinoma. Manual rule states the re-read wins regardless of date. Agent should answer pathology_lung_primary=nsclc AND surface the original SCLC language as contradicting_evidence with reason_not_decisive citing the re-read rule."
}
