{
  "patient_id": "patient_fake_cancer_12",
  "category": "probable",
  "lung_cancer_status": "probable",
  "leaf_answers": {
    "pathology_report_present": "no",
    "pathology_lung_primary": "not_applicable",
    "cytology_supports_lung_primary": "no",
    "imaging_lung_lesion": "yes",
    "oncologist_lung_cancer_diagnosis_in_note": "yes",
    "icd_lung_cancer_present": "yes"
  },
  "applicability": {
    "pathology_lung_primary": "not_applicable",
    "cytology_supports_lung_primary": "applicable"
  },
  "expected_contradicting_evidence_fields": [],
  "difficulty": "easy",
  "difficulty_notes": "API-generated. Seed: incidental lung mass on CT abdomen for unrelated complaint."
}
