{
  "patient_id": "patient_easy_probable_02",
  "category": "probable",
  "lung_cancer_status": "probable",
  "leaf_answers": {
    "pathology_report_present": "no",
    "pathology_lung_primary": "not_applicable",
    "cytology_supports_lung_primary": "no",
    "imaging_lung_lesion": "yes",
    "oncologist_lung_cancer_diagnosis_in_note": "yes",
    "icd_lung_cancer_present": "no"
  },
  "applicability": {
    "pathology_lung_primary": "not_applicable",
    "cytology_supports_lung_primary": "applicable"
  },
  "expected_contradicting_evidence_fields": [],
  "difficulty": "easy",
  "difficulty_notes": "API-generated. Seed: cough and declining functional status; patient declines biopsy due to advanced age and frailty."
}
